{
  "file_count": 42,
  "files": {
    "divisions/wa/local/spokane_valley_5367167_609eb262-5b91-5d1c-812b-521426f061be.yaml": "6dda8788f47d730af497c7afe1f53795b161bffa1e54dfc4385fd24419c8b663",
    "divisions/wa/local/sprague_5367175_5f26d332-9f6d-5f7f-9141-2a5e75ad522b.yaml": "695c76eff105be55aaa960e2bf342d3d829358a8843e30d5109273a465620ea2",
    "divisions/wa/local/springdale_5367210_14d73b0b-4db1-5611-9387-1f596b7dc517.yaml": "ef1083c00f58e7ed60756736e6fffb4eb03e055662600d0b65a8eb1a4cbdb1ad",
    "divisions/wa/local/stanwood_5367455_feb84daa-e3a4-541f-abf2-ad2bccb45308.yaml": "27bdeee02125f8329ac54f9e2940494063db56d8a0806f08f2637a2997375f48",
    "divisions/wa/local/starbuck_5367490_fd6b799d-d999-52d9-92bc-5348513fe95b.yaml": "318b5cbbca912c59ca680dce3823dfd072d8fdb49b6303a2899fc139c7afb589",
    "divisions/wa/local/steilacoom_5367770_5526a76d-3fbe-50d5-8118-eb761fc22f14.yaml": "068df14c9f7792f62f3d4d8c43f8721bb8a85bda6660387f6dc729996510d756",
    "divisions/wa/local/stevenson_5367875_54ab83a2-13ce-5941-9120-1c5252add72b.yaml": "3d8433294a5d84fa61f203b026eef422dbbe3c5702fc88873b11f7446055500b",
    "divisions/wa/local/sultan_5368260_fae70786-584e-5b38-9061-ed94bd0129dc.yaml": "5646cda1f2d0a037d86ed74d59fac11aae52320177a5ac301c0a913a1dbecfcd",
    "divisions/wa/local/sumas_5368330_3b509161-e534-5790-936d-c4787b54c258.yaml": "25337be7074f40deeca51ec796427fef66f269ad16dc8a14f5dec7ee67a66c29",
    "divisions/wa/local/sumner_5368435_79eec367-92ec-53de-adbb-d5db574f626d.yaml": "459fada067bdea88ba660705251dff26f2860130e67f23cf032e5f0011c2c845",
    "divisions/wa/local/sunnyside_5368750_b91a0f0a-b126-52a5-bc44-a4f02091839c.yaml": "e0707e752040bb16c7c115a87438b87c85d7a062abc1c5f42616ffcd330e5cb7",
    "divisions/wa/local/tekoa_5370560_c5b4d059-c2bb-5038-a2f2-c43203cf1b08.yaml": "4a743ac91f67223be77bec23b60f4af96b69ce490c1cbbb29264b0bf99c2bccb",
    "divisions/wa/local/tenino_5370630_7b0b9cfe-e24c-5754-8e1d-850bb8970699.yaml": "dc6dd411264d1061c626cbe321503a26fe126a64a1e22f1d1c2a1cd9a73af604",
    "divisions/wa/local/tieton_5371400_52577a69-ffec-554d-b7f3-0a3c239bb683.yaml": "a4103a412585d9ddff2719e2c536eaa3415c5e92d69cf0ed458994fbcbb6f885",
    "divisions/wa/local/toledo_5371785_8129846d-3e2f-5539-874c-b11687d9665d.yaml": "f6568c188802cdae9375585b437df6ca31b65eb229fc3db4da3720e7ffdae131",
    "divisions/wa/local/tonasket_5371890_ab7716c2-04c0-5272-b5af-a872b2aa3902.yaml": "0372cc3efa7269826a1e48fa1e84c72edadbf411f54783de83e8a46895a8513e",
    "divisions/wa/local/toppenish_5371960_7f7e0f20-9deb-5b5d-8da4-a7fed726e98b.yaml": "726011b0bacbba91c0bf275553bf0190b69636945757c41bb75bcf89237d973e",
    "divisions/wa/local/tukwila_5372625_4cd09d53-668f-5be1-b5b2-5a22c60d240b.yaml": "0bacd914c685268f38e9cfb23680daf97157d9adbcd9e9f118eae0863385c448",
    "divisions/wa/local/tumwater_5372905_3a4441fa-182d-5b86-a94a-779aa6dece4d.yaml": "eb76268e2fb8a9b295d4683939943af53248a76e28e9eeb0efbd4ea44553b558",
    "divisions/wa/local/twisp_5373080_60d04dfc-b995-5471-b449-c4b353a44d42.yaml": "9f5971c45c2cad80944caa8e6b342e72616444bc045ab76a0cf0cdaa3cf0f4e7",
    "divisions/wa/washington_stub.yaml": "fbf75f75e69c3543dd46788a52a2feef88290b898f7294586fb146b551f1322f",
    "jurisdictions/wa/local/spokane_valley_8dcdb6a9-4477-5fc8-9e18-2fa08f75b1a1.yaml": "ebc7e4aabc8a019b617b40713b1927653cec067af9998967625e8c1dc93f89e9",
    "jurisdictions/wa/local/sprague_cdeed08f-912c-55c1-b345-56e91825b5e7.yaml": "1da6ebdb3b06cbf1ce80191442ddd125c6743eab3efb320eed406cd881f9295a",
    "jurisdictions/wa/local/springdale_bb4fd0db-f313-5bf2-ad62-1f3412c270cd.yaml": "7066fab9a14cc7c949b64c4d0529d064a10b3b85cf5603a835f7f0cd321f9efa",
    "jurisdictions/wa/local/stanwood_2b24e4d1-605b-5c02-8802-4f595a163026.yaml": "7464c11431b786687a76c313558050c7a2a830f53aaf0af1a34e18c907dd976a",
    "jurisdictions/wa/local/starbuck_ea38226a-4f0e-5702-a0ae-23c2119de804.yaml": "5f7713a1d79d6bd4175eed59e3962e451a6dfe4f2187e57a145a19ffc0ac5306",
    "jurisdictions/wa/local/steilacoom_47f38973-cb08-56ae-8b6e-088838acf6ed.yaml": "e0c119fc250cb211cd4ea6fd5b8df544bc86e435a7704613c8b3054835037cbd",
    "jurisdictions/wa/local/stevenson_eec5b35e-3173-51ba-be2f-e8d47450d39c.yaml": "3e4018283b0f94ad9d5d76880f8d1a578fd398a13659cf55dcf13181f816744d",
    "jurisdictions/wa/local/sultan_df01713a-7d43-5bbc-877f-7a226591993c.yaml": "8dcf96c090f8b5846b68eee1da4db8c959e3a89f1ab394533259c4aaf8981e91",
    "jurisdictions/wa/local/sumas_85775a53-71e0-5031-92a2-c0f005fa7c08.yaml": "8a883195a54803b197249108cb9805f2bde8e48c5b7bf0af981197f98314e7f7",
    "jurisdictions/wa/local/sumner_2c164069-ea35-5672-89c0-0deafac77d37.yaml": "0585f2da7873349dc1bca00670735bb35b78a67bf470b0789a2b387404f248d1",
    "jurisdictions/wa/local/sunnyside_ef806ffc-95bd-5346-ab8e-f4a156a519ca.yaml": "7cb58c2d21b0f503ded539081d82ac70859111addb90404477284d89d74e9a89",
    "jurisdictions/wa/local/tekoa_2764a9d7-271a-51d3-9203-4fee691d64aa.yaml": "e30b3c0c846c25793f4bbe4aee88ac7b41d20b6aa46bb7baeb05772be8f85673",
    "jurisdictions/wa/local/tenino_7e17c812-520d-5998-978e-9b7288601890.yaml": "26dddff58e61caf707c48800c75b6471cf31f41c7a0ca459b72630a5e7380560",
    "jurisdictions/wa/local/tieton_6049d03c-e909-5b9b-b67f-fc3a29809a30.yaml": "b9c7500559702fda25a4c32c2eabfaed7d7e36ba9815a830b3377cd3fd4c7632",
    "jurisdictions/wa/local/toledo_21b9a29a-b0ec-5c9e-9748-2408d4f35d12.yaml": "8db8c4a020db97967a9facfb9f0c09cfb7be25c0b726518da4deabd6c8f2854b",
    "jurisdictions/wa/local/tonasket_f9e668c1-c559-545a-aab8-bddbade02b1f.yaml": "ab205d00590970d52f1436622e47daf562347533ab12e9b02ba09cc908d426a3",
    "jurisdictions/wa/local/toppenish_d5cde555-47ff-552c-942c-179bade7ee07.yaml": "7700204347048c0c71a759bbfa7cc96129a514a46c7ace60d3a40c0d879474d8",
    "jurisdictions/wa/local/tukwila_03bbb071-7627-5fce-8268-6a0e3bd46245.yaml": "9797af8dd310b7898098d2e28330549cb997ebc90fe7e609697b5bf4abe099ed",
    "jurisdictions/wa/local/tumwater_ed12bc48-254a-561d-a88d-ac56881e1f6a.yaml": "2dc06c62662caa193cb466ddc1581a840fa3024431e102ad423b897fc9da1390",
    "jurisdictions/wa/local/twisp_c3e6efaf-21aa-5b79-8815-bf352dcd2f46.yaml": "f5ab91395a1b0bd38f659f6a0641e2a057def1c893d72eeb4afc78a7f5e341e4",
    "jurisdictions/wa/washington_stub.yaml": "2e6120611f3a8f45efc84502fa42bab887e0c95bc82ba500b05d650c81c1fc65"
  },
  "inventory_sha256": "7effff97fabf7025a7bd2bd41b550640915d7c0bbb120b601c76648ee8ee0f62",
  "run_id": "b4a0660c14be4051ef71",
  "schema_version": 1,
  "shared_artifact_count": 2,
  "shared_paths": [
    "divisions/wa/washington_stub.yaml",
    "jurisdictions/wa/washington_stub.yaml"
  ],
  "target_artifact_count": 40,
  "target_paths": [
    "divisions/wa/local/spokane_valley_5367167_609eb262-5b91-5d1c-812b-521426f061be.yaml",
    "divisions/wa/local/sprague_5367175_5f26d332-9f6d-5f7f-9141-2a5e75ad522b.yaml",
    "divisions/wa/local/springdale_5367210_14d73b0b-4db1-5611-9387-1f596b7dc517.yaml",
    "divisions/wa/local/stanwood_5367455_feb84daa-e3a4-541f-abf2-ad2bccb45308.yaml",
    "divisions/wa/local/starbuck_5367490_fd6b799d-d999-52d9-92bc-5348513fe95b.yaml",
    "divisions/wa/local/steilacoom_5367770_5526a76d-3fbe-50d5-8118-eb761fc22f14.yaml",
    "divisions/wa/local/stevenson_5367875_54ab83a2-13ce-5941-9120-1c5252add72b.yaml",
    "divisions/wa/local/sultan_5368260_fae70786-584e-5b38-9061-ed94bd0129dc.yaml",
    "divisions/wa/local/sumas_5368330_3b509161-e534-5790-936d-c4787b54c258.yaml",
    "divisions/wa/local/sumner_5368435_79eec367-92ec-53de-adbb-d5db574f626d.yaml",
    "divisions/wa/local/sunnyside_5368750_b91a0f0a-b126-52a5-bc44-a4f02091839c.yaml",
    "divisions/wa/local/tekoa_5370560_c5b4d059-c2bb-5038-a2f2-c43203cf1b08.yaml",
    "divisions/wa/local/tenino_5370630_7b0b9cfe-e24c-5754-8e1d-850bb8970699.yaml",
    "divisions/wa/local/tieton_5371400_52577a69-ffec-554d-b7f3-0a3c239bb683.yaml",
    "divisions/wa/local/toledo_5371785_8129846d-3e2f-5539-874c-b11687d9665d.yaml",
    "divisions/wa/local/tonasket_5371890_ab7716c2-04c0-5272-b5af-a872b2aa3902.yaml",
    "divisions/wa/local/toppenish_5371960_7f7e0f20-9deb-5b5d-8da4-a7fed726e98b.yaml",
    "divisions/wa/local/tukwila_5372625_4cd09d53-668f-5be1-b5b2-5a22c60d240b.yaml",
    "divisions/wa/local/tumwater_5372905_3a4441fa-182d-5b86-a94a-779aa6dece4d.yaml",
    "divisions/wa/local/twisp_5373080_60d04dfc-b995-5471-b449-c4b353a44d42.yaml",
    "jurisdictions/wa/local/spokane_valley_8dcdb6a9-4477-5fc8-9e18-2fa08f75b1a1.yaml",
    "jurisdictions/wa/local/sprague_cdeed08f-912c-55c1-b345-56e91825b5e7.yaml",
    "jurisdictions/wa/local/springdale_bb4fd0db-f313-5bf2-ad62-1f3412c270cd.yaml",
    "jurisdictions/wa/local/stanwood_2b24e4d1-605b-5c02-8802-4f595a163026.yaml",
    "jurisdictions/wa/local/starbuck_ea38226a-4f0e-5702-a0ae-23c2119de804.yaml",
    "jurisdictions/wa/local/steilacoom_47f38973-cb08-56ae-8b6e-088838acf6ed.yaml",
    "jurisdictions/wa/local/stevenson_eec5b35e-3173-51ba-be2f-e8d47450d39c.yaml",
    "jurisdictions/wa/local/sultan_df01713a-7d43-5bbc-877f-7a226591993c.yaml",
    "jurisdictions/wa/local/sumas_85775a53-71e0-5031-92a2-c0f005fa7c08.yaml",
    "jurisdictions/wa/local/sumner_2c164069-ea35-5672-89c0-0deafac77d37.yaml",
    "jurisdictions/wa/local/sunnyside_ef806ffc-95bd-5346-ab8e-f4a156a519ca.yaml",
    "jurisdictions/wa/local/tekoa_2764a9d7-271a-51d3-9203-4fee691d64aa.yaml",
    "jurisdictions/wa/local/tenino_7e17c812-520d-5998-978e-9b7288601890.yaml",
    "jurisdictions/wa/local/tieton_6049d03c-e909-5b9b-b67f-fc3a29809a30.yaml",
    "jurisdictions/wa/local/toledo_21b9a29a-b0ec-5c9e-9748-2408d4f35d12.yaml",
    "jurisdictions/wa/local/tonasket_f9e668c1-c559-545a-aab8-bddbade02b1f.yaml",
    "jurisdictions/wa/local/toppenish_d5cde555-47ff-552c-942c-179bade7ee07.yaml",
    "jurisdictions/wa/local/tukwila_03bbb071-7627-5fce-8268-6a0e3bd46245.yaml",
    "jurisdictions/wa/local/tumwater_ed12bc48-254a-561d-a88d-ac56881e1f6a.yaml",
    "jurisdictions/wa/local/twisp_c3e6efaf-21aa-5b79-8815-bf352dcd2f46.yaml"
  ]
}
