{
  "file_count": 42,
  "files": {
    "divisions/wa/local/nooksack_5349275_d7c39115-b823-5040-8291-7b00fd0e994a.yaml": "64fb958a6833accb9aab2199dadfdf38b921ab5ed8d3e578ab034c6f22ccba42",
    "divisions/wa/local/normandy_park_5349415_b3c82ebd-6aa6-50a8-bd20-be8e3287d493.yaml": "e93b4a7339e7226659081ef6bf63ce93e3ce5b916ee8c5fa975fc80fe6fb6a1c",
    "divisions/wa/local/north_bend_5349485_32ec34a5-a1c6-5b8d-8475-7220364b3f9d.yaml": "b58efc0ee449f3f1847eb59644aae80659434e87e3125e1c246e73f32b4cb643",
    "divisions/wa/local/north_bonneville_5349555_6529be78-6b79-580a-ad4c-9917f7124437.yaml": "c3840f47f2128aa9728aced86e5e813ded7fd449667f835527286d9b0ead7d9a",
    "divisions/wa/local/northport_5350045_53a443d2-a301-5fbc-a8c2-b7b36748df52.yaml": "58598a16b4bbce35778e23b9e9b7113a65347b564bc762dbf5a5b004bb6d7181",
    "divisions/wa/local/oak_harbor_5350360_6430b0d9-b7c5-5bf1-845e-9ef4d4be7b0e.yaml": "5da2a80f65cf5b139b6e4aee2fa828f3b16de70194d5be5b5525b8b3341100f9",
    "divisions/wa/local/oakesdale_5350325_df04185e-69d8-5b02-b9ab-b071a77c6f83.yaml": "96acc6e03eb1519800fabe66df47a3301dcf9effe3c0af8321b8acdf80f53ce5",
    "divisions/wa/local/oakville_5350430_d633d9e2-aace-5809-9fa8-4a3374ac1ae7.yaml": "4533f939628c692c3c00f6b34314ee72cc305618b50d4def2e5452ce7e3edbee",
    "divisions/wa/local/ocean_shores_5350570_b76892b0-e8b4-5608-9500-1a61e929b5c7.yaml": "bdc8ba113dd252b8385c50d715f936f1d85e23495c8697dbf001a62c22f3e7ae",
    "divisions/wa/local/odessa_5350745_da96fd25-2c01-59c9-957a-d75605e9b917.yaml": "9b84a6bacb57b2f26ea5c179a7a24999dc01332c7a328c62ac41338edfb1b40a",
    "divisions/wa/local/okanogan_5350920_a9cc8749-8989-5cfe-a597-a8a896f16ad9.yaml": "1a049cfe30b85a0f2b29298a3ca4542930f6ba7403f5b5cd326be37ed3c795f5",
    "divisions/wa/local/omak_5351340_864d2eb9-8935-56f1-b941-132fd440227d.yaml": "2740623c9ab650c96e8d17f92f3282c8586ee128d8ebfb4343461a8959005c6c",
    "divisions/wa/local/oroville_5351970_c95e0177-5f36-57b6-b1a7-08f9f9d74898.yaml": "cc1767d3445b0e556e57a25a12d85020d751b4dab67b24ad668fab6a2f27093b",
    "divisions/wa/local/orting_5352005_49cb3714-5b91-5d42-91d9-207a473f8417.yaml": "71764d2962f58bc780b5b6f25b2388ef0b581b36850de62a184bf83e1c15d99c",
    "divisions/wa/local/othello_5352215_0a78ac01-c633-579d-8ded-d9205dcf1564.yaml": "4ef1f35edf02576402b45f2ef8746541b2083cb07f0e2f9c89849f63e8f36169",
    "divisions/wa/local/pacific_5352495_ce0681bf-9677-5cad-9ece-c78841c9d4b3.yaml": "f097c01672ecbd2caa71f35676f45ea8c2055fa40b92dc72cfcba05ec0665dbc",
    "divisions/wa/local/palouse_5352950_cba9120b-11d6-5bd5-a851-70430049aac9.yaml": "0c3e545f3a806448d3b5175916c56c33ef6815f6f588d99a4f33e3d69b264443",
    "divisions/wa/local/pasco_5353545_44a40dd4-1fd2-5d45-a8f8-bf910a36a02e.yaml": "d87568e9d582598bd6d001379f8335a24a4b4654883f43c23212e1dc2c8084c3",
    "divisions/wa/local/pateros_5353720_116982c9-2ea6-5fcd-bed8-c1c6ae790137.yaml": "eed2a138028b79b33e0b6c3534866be88869fd0642838349277a5d307c361602",
    "divisions/wa/local/pe_ell_5353930_82de65fd-d1e8-58a4-9151-21934103a245.yaml": "163bf95f0fc97614908ba97b127be01ccad4b3181159406eea0c37624b8bc169",
    "divisions/wa/washington_stub.yaml": "64a973041134faf0c79bfd528bb632bfe6b5d39d58c0f39d02ef798477b4e173",
    "jurisdictions/wa/local/nooksack_d6c15e8d-8285-59c6-ae42-e824d52a931d.yaml": "014a290b37e9e0306a0c81dafcb9333091b49a1c91135c330fccba08d7c0f780",
    "jurisdictions/wa/local/normandy_park_d3b4eca1-9bb8-51aa-a226-0e4391f893f5.yaml": "0a785913c8fc09a1832cb1e8665f8f5b5eac5cd8f9ea820a0e2397c79015f694",
    "jurisdictions/wa/local/north_bend_c59168b4-a03f-5cbe-9574-9daab1814a9a.yaml": "454d86ff1ca8a1513f272aa71f4bb8ef3bb3424ff1fd0bf61afcbc5584e2caa3",
    "jurisdictions/wa/local/north_bonneville_3f79c2c0-96c5-5139-8b15-3331277af71d.yaml": "b0bf8692d77410a9f327915e8b2ceaefb8905eddd2baa465e00fec3eb744bfff",
    "jurisdictions/wa/local/northport_4f5a0dd1-bed0-5d2e-9180-f05a381ae404.yaml": "9cf934071c27cb90a36b8103a8d4a523ac86422f3097d2d0bc87c87305e64149",
    "jurisdictions/wa/local/oak_harbor_63b985b1-ffad-571c-b20d-137580d264d9.yaml": "786595a9f87e1c5586b721f6048a27eeac59ed5698737373ddbc95d6cca8055c",
    "jurisdictions/wa/local/oakesdale_d18e074f-13c4-547f-a8cd-87a7582d667c.yaml": "8479f42840ac8f086abf28092f8cdb3b26c213e1dc94de402226401583d7415b",
    "jurisdictions/wa/local/oakville_8aaf7357-1072-5d1b-a89d-7d60b29540b7.yaml": "28564688952ede63f0796c91a84225e8df5f45ed0b62edf5759d8661b35e2c47",
    "jurisdictions/wa/local/ocean_shores_ef9dca12-d9cd-5b1b-b9be-c413917b6c05.yaml": "776933860b24f38fedfbf06b6982784639956208511883443241b304bcf60617",
    "jurisdictions/wa/local/odessa_60bfdab7-3b45-51df-b102-47a5475d2916.yaml": "003c057bfa3f3c690601db0e6369c215c55cd6ac998a6e40b25aece8b9f31a91",
    "jurisdictions/wa/local/okanogan_a7ccea9c-386f-51e0-92d5-2a923b25bf54.yaml": "cc2447867e1ccd54a8dacbf7045bf07a617308e4f310577a05ad194f7e9fa0ee",
    "jurisdictions/wa/local/omak_438c4e77-fa53-5124-ac2e-7466f89e91c4.yaml": "c175df8735368977fb193b54ff506abf605d1d37f3fa8e3e842800cc1f543c4f",
    "jurisdictions/wa/local/oroville_fcefa84a-d9e2-505e-ba6b-9e488cb3c6b4.yaml": "edcf64fe571b4c004bce083f9ac2e3e200e3ff1ff11382fb4e2818669bc4a2dd",
    "jurisdictions/wa/local/orting_61f71d79-edb4-5191-9f9d-5bf91d24e962.yaml": "23fc8daf3881574577602cf123370bd240321d731d68972da1403d1ec2464b03",
    "jurisdictions/wa/local/othello_7a993192-b1a3-5323-b53e-b1bf3f9daef2.yaml": "8178102d965721b7cbe1de43fd88ca230dad9ce35bcde7a4a0e2502d812154d9",
    "jurisdictions/wa/local/pacific_6ce70919-14b1-5858-8396-94b1ae41475e.yaml": "7f127dcee303e95b88338b3c6a43549ba51a7dc0310106789dddf082e94927ef",
    "jurisdictions/wa/local/palouse_81ae961c-793f-58eb-a91c-4e82aaad106e.yaml": "f2464c27c9f568ea7d8ff405a571185b053105b93838d5595035a11f32d3a2e6",
    "jurisdictions/wa/local/pasco_e3d94f59-affa-5612-8f7c-8914ccd9acd8.yaml": "871d322556ce40e63a423e54d4a3a0c6db43cc7018bc4d53c532a88fb1205713",
    "jurisdictions/wa/local/pateros_33327a6f-3523-5352-a9f7-d2a3d9aa3096.yaml": "06c74db4c1e5526bd3bfd2860bce693713c78510f354e45c7334f13678d24f53",
    "jurisdictions/wa/local/pe_ell_b29aedba-a021-5b00-bad1-bec41c1c15d4.yaml": "4f4c8d73ac8b191143e700396848e678edd950464102d53e328f900433b0c27c",
    "jurisdictions/wa/washington_stub.yaml": "c5b20b1f39508a6975e3762e645c74be9ad46aa6e409679635283fc2591a46ba"
  },
  "inventory_sha256": "f30b8668c211535f97a275c553bb3fd51f78a615c0095abd1ad7f0242dfe5052",
  "run_id": "0f66c79b81482f1fa935",
  "schema_version": 1,
  "shared_artifact_count": 2,
  "shared_paths": [
    "divisions/wa/washington_stub.yaml",
    "jurisdictions/wa/washington_stub.yaml"
  ],
  "target_artifact_count": 40,
  "target_paths": [
    "divisions/wa/local/nooksack_5349275_d7c39115-b823-5040-8291-7b00fd0e994a.yaml",
    "divisions/wa/local/normandy_park_5349415_b3c82ebd-6aa6-50a8-bd20-be8e3287d493.yaml",
    "divisions/wa/local/north_bend_5349485_32ec34a5-a1c6-5b8d-8475-7220364b3f9d.yaml",
    "divisions/wa/local/north_bonneville_5349555_6529be78-6b79-580a-ad4c-9917f7124437.yaml",
    "divisions/wa/local/northport_5350045_53a443d2-a301-5fbc-a8c2-b7b36748df52.yaml",
    "divisions/wa/local/oak_harbor_5350360_6430b0d9-b7c5-5bf1-845e-9ef4d4be7b0e.yaml",
    "divisions/wa/local/oakesdale_5350325_df04185e-69d8-5b02-b9ab-b071a77c6f83.yaml",
    "divisions/wa/local/oakville_5350430_d633d9e2-aace-5809-9fa8-4a3374ac1ae7.yaml",
    "divisions/wa/local/ocean_shores_5350570_b76892b0-e8b4-5608-9500-1a61e929b5c7.yaml",
    "divisions/wa/local/odessa_5350745_da96fd25-2c01-59c9-957a-d75605e9b917.yaml",
    "divisions/wa/local/okanogan_5350920_a9cc8749-8989-5cfe-a597-a8a896f16ad9.yaml",
    "divisions/wa/local/omak_5351340_864d2eb9-8935-56f1-b941-132fd440227d.yaml",
    "divisions/wa/local/oroville_5351970_c95e0177-5f36-57b6-b1a7-08f9f9d74898.yaml",
    "divisions/wa/local/orting_5352005_49cb3714-5b91-5d42-91d9-207a473f8417.yaml",
    "divisions/wa/local/othello_5352215_0a78ac01-c633-579d-8ded-d9205dcf1564.yaml",
    "divisions/wa/local/pacific_5352495_ce0681bf-9677-5cad-9ece-c78841c9d4b3.yaml",
    "divisions/wa/local/palouse_5352950_cba9120b-11d6-5bd5-a851-70430049aac9.yaml",
    "divisions/wa/local/pasco_5353545_44a40dd4-1fd2-5d45-a8f8-bf910a36a02e.yaml",
    "divisions/wa/local/pateros_5353720_116982c9-2ea6-5fcd-bed8-c1c6ae790137.yaml",
    "divisions/wa/local/pe_ell_5353930_82de65fd-d1e8-58a4-9151-21934103a245.yaml",
    "jurisdictions/wa/local/nooksack_d6c15e8d-8285-59c6-ae42-e824d52a931d.yaml",
    "jurisdictions/wa/local/normandy_park_d3b4eca1-9bb8-51aa-a226-0e4391f893f5.yaml",
    "jurisdictions/wa/local/north_bend_c59168b4-a03f-5cbe-9574-9daab1814a9a.yaml",
    "jurisdictions/wa/local/north_bonneville_3f79c2c0-96c5-5139-8b15-3331277af71d.yaml",
    "jurisdictions/wa/local/northport_4f5a0dd1-bed0-5d2e-9180-f05a381ae404.yaml",
    "jurisdictions/wa/local/oak_harbor_63b985b1-ffad-571c-b20d-137580d264d9.yaml",
    "jurisdictions/wa/local/oakesdale_d18e074f-13c4-547f-a8cd-87a7582d667c.yaml",
    "jurisdictions/wa/local/oakville_8aaf7357-1072-5d1b-a89d-7d60b29540b7.yaml",
    "jurisdictions/wa/local/ocean_shores_ef9dca12-d9cd-5b1b-b9be-c413917b6c05.yaml",
    "jurisdictions/wa/local/odessa_60bfdab7-3b45-51df-b102-47a5475d2916.yaml",
    "jurisdictions/wa/local/okanogan_a7ccea9c-386f-51e0-92d5-2a923b25bf54.yaml",
    "jurisdictions/wa/local/omak_438c4e77-fa53-5124-ac2e-7466f89e91c4.yaml",
    "jurisdictions/wa/local/oroville_fcefa84a-d9e2-505e-ba6b-9e488cb3c6b4.yaml",
    "jurisdictions/wa/local/orting_61f71d79-edb4-5191-9f9d-5bf91d24e962.yaml",
    "jurisdictions/wa/local/othello_7a993192-b1a3-5323-b53e-b1bf3f9daef2.yaml",
    "jurisdictions/wa/local/pacific_6ce70919-14b1-5858-8396-94b1ae41475e.yaml",
    "jurisdictions/wa/local/palouse_81ae961c-793f-58eb-a91c-4e82aaad106e.yaml",
    "jurisdictions/wa/local/pasco_e3d94f59-affa-5612-8f7c-8914ccd9acd8.yaml",
    "jurisdictions/wa/local/pateros_33327a6f-3523-5352-a9f7-d2a3d9aa3096.yaml",
    "jurisdictions/wa/local/pe_ell_b29aedba-a021-5b00-bad1-bec41c1c15d4.yaml"
  ]
}
