{
  "file_count": 42,
  "files": {
    "divisions/wa/local/roslyn_5360055_9791a8c1-17b3-583a-94df-ecc9cf2946d4.yaml": "857c68d67a04aec268b5545ac535922d462013cccb0582224fbc6717a2cb9ffc",
    "divisions/wa/local/roy_5360160_00cbf25c-b5ca-5866-8271-2e2a4e593f63.yaml": "2edd83eeff34a6ed06a82188c728851348b9dbf540413d93e758b8708f77ea6c",
    "divisions/wa/local/royal_city_5360230_eab43f82-5323-5070-9f15-566e472be607.yaml": "004f5528dece09356262d7907cecdf2352c40a7835b8b7427c10f2bc5f0987ad",
    "divisions/wa/local/ruston_5360510_0aef1da0-0200-58c0-ba4d-0d7ccc62dfe4.yaml": "31d08c571c22c2cc478be76208cb189ef231e4f2adaab16b987e44f757f5f247",
    "divisions/wa/local/sammamish_5361115_6ac65a02-d320-5abd-89c1-3bee8a15c5ff.yaml": "934fd7da9ee5bdef9cfb171234cb645e891aadc8af5e49c1aea635c0fc2df09e",
    "divisions/wa/local/seatac_5362288_fbc84465-2017-5f3d-9049-cda4f930a783.yaml": "4d63b44bccdb80c25095127e7e847a6b42281f1914dccd289bf72e2c7ffc6703",
    "divisions/wa/local/sedro-woolley_5363210_9f1574d9-c80d-5688-aa8d-8d7da990d343.yaml": "6f9a6140993a68da6ef2eccdf26a911e7b49b23c506edc132b8b80065f6ef0cc",
    "divisions/wa/local/selah_5363280_b3dc154b-2429-5109-a209-906ca26e7d14.yaml": "73d551c8329c61bc01c3fd40a72e198927e6dd111c50c930de5a3401e66082ce",
    "divisions/wa/local/sequim_5363385_ea5eb65a-5478-500d-85e1-3b287fe5aee7.yaml": "0e6cdd2a2fe522a877c933e46414e0d9aabab455205cbf4cb334c8e52a190333",
    "divisions/wa/local/shelton_5363735_243e71e0-80e0-570a-83d3-35eb9866fea2.yaml": "73c014a3ecab317b969022b4207fffa84400cde1eede2c7388d1825bfd28a5bd",
    "divisions/wa/local/shoreline_5363960_8c43132d-24fa-511a-96f8-690f39b9b97d.yaml": "766bb7d50aeb7e07244c85f7a0b1d44b85a076f4241bf01adf9d8a3c05830b73",
    "divisions/wa/local/skykomish_5364855_2d3623a9-b312-5302-bcf9-ab6592f50d84.yaml": "25c9fb36ea100b22b9a235fea0c7e93f446761e563d4ce0f31a2e2bac718ea34",
    "divisions/wa/local/snohomish_5365170_beb89d0c-bd20-5944-acdd-66f30d097cf7.yaml": "115c1c7037b1163f38d2fc33d2370b0498fa6a059d351a6ae4798690922539b2",
    "divisions/wa/local/snoqualmie_5365205_acd04e0c-d4fa-5dcc-a378-2abe1b663ad5.yaml": "9df528fd2ce6c0cbdcc5bab56cad8c8daec9fb1344c2c84bc0c9335c2f245300",
    "divisions/wa/local/soap_lake_5365345_10be27a2-fc3d-5f2e-a598-85f4e468224a.yaml": "989dde298a5c27e8513a24e0299b641ac98b68f2ff9e994428c21614c54b22dd",
    "divisions/wa/local/south_bend_5365625_f3e2fdb7-2047-5ae1-9369-a979f1585ee1.yaml": "5dac1c34df395dfa61d0c7dc0a542839040b515c491b8abf67b6ed2e0a8be59a",
    "divisions/wa/local/south_cle_elum_5365765_e159eed1-3ef8-5209-a976-56499b187c2a.yaml": "2c28eb106c530233bc7b457c5a992f75dbe7ecb1d5c05ff3aff7f0e66f348ce8",
    "divisions/wa/local/south_prairie_5366045_bb62e046-f9a9-5244-9565-90b8e7573a30.yaml": "700c9a0cf8b347a970510c046d32a8698d784ca2e6771c275afd0eb3b0f86d81",
    "divisions/wa/local/spangle_5366290_b755fb2c-6eed-5dc0-9fa3-1db6ef490481.yaml": "495bceb8234b0d2c09c805e54765cbb24feee0131b0fdc2aae82dd3b15ca09a7",
    "divisions/wa/local/st._john_5360860_2c05eeeb-08e9-569b-a6c5-051f96dee54e.yaml": "8c50ccaace44dc2623f53ed9e6a3e5871433f392ef8d6f99e1fcfd1379e0a3d8",
    "divisions/wa/washington_stub.yaml": "fbf75f75e69c3543dd46788a52a2feef88290b898f7294586fb146b551f1322f",
    "jurisdictions/wa/local/roslyn_56ba9bd7-7618-573e-b9ff-7f62a05c96ed.yaml": "72a8fd0cfadcbb8b106cd397ce9f562fc0ea56192c22e827f3995a099d4a771d",
    "jurisdictions/wa/local/roy_95eccf6a-98f1-53b4-a934-3642fb795772.yaml": "88873cb1371cb6cbafa2bd5d8e519e64227c657f5d0a9f8cfe71448eca175d6b",
    "jurisdictions/wa/local/royal_city_756777f1-5612-5860-96c0-6dab7402fedf.yaml": "c4241d613cc541744a44ccb4c14d8718a882265b7b91dbea5aff346f29618106",
    "jurisdictions/wa/local/ruston_512e7499-33a1-5226-b698-d686c5ff04ef.yaml": "f1453607cbb1eba61dcc3796f266ac269458b8a81948535ac10ca09854af7449",
    "jurisdictions/wa/local/sammamish_0779e2b3-822c-5a9c-abf9-477c829994ed.yaml": "d07118796e2a6e6f043fe3c957d3947ba0f2717291586007b66101f8fb8466bd",
    "jurisdictions/wa/local/seatac_7037d44c-db44-5900-94f2-26a5b534ce53.yaml": "46d42aad29972a27aa85fdac9670c6fe2b9379b4d99a315717937496f6fe137a",
    "jurisdictions/wa/local/sedro-woolley_92e592a9-34ff-5fc0-aa5a-47209fd348b5.yaml": "dadaa0c7806bd62edca4440b930b76b29bbfe738f112a3917617be735e2e3cc7",
    "jurisdictions/wa/local/selah_7bd82aca-a4e5-5bc5-b72a-11f461ab188a.yaml": "0ee345dd3241ba3262887295f9a9899195cc5570c170583f3793aff4e9340c73",
    "jurisdictions/wa/local/sequim_dc629222-8e07-5543-9ed6-723cf71bb843.yaml": "f7937e2334426c3d7d0bc8000d234a549b792c6842fba0376891178be240a31a",
    "jurisdictions/wa/local/shelton_7f82c49a-384f-5ff9-8680-70e899261b0c.yaml": "7ff63d5db587df987886b079379bcec7481e5e1343240943af909f477d6311b7",
    "jurisdictions/wa/local/shoreline_a6e208c4-59e9-57ea-b6dd-d986857eaf02.yaml": "fd3823feb9d8cd0564ddb25b551b671228e2e1abd79d7eed0cde64ff1e7cd158",
    "jurisdictions/wa/local/skykomish_ecbac1c0-363a-5878-a596-5517707edb16.yaml": "60b843ad0c8d05ce2f8f86b477ead666322cbc4c3f3015ed0c90d949a66149b4",
    "jurisdictions/wa/local/snohomish_7ffebc86-3ebc-5883-80df-cf3cac48cf75.yaml": "846577a38428a5c4b7906d41b2fa53b2204e8faa121b35e36abf3f73ed109383",
    "jurisdictions/wa/local/snoqualmie_c19cd622-6539-58f2-bdb5-d9bf82c5f03e.yaml": "75976bd060b2c9fbba69d9a9ebaae52f2ef4ea337a3bdf8576175e6fae5d07d7",
    "jurisdictions/wa/local/soap_lake_0543545c-898e-5026-9155-c47a603b72cf.yaml": "870a80a5a15fae5e4a089e7bccd3cbf49cd912bbc668683de83c49e74d563428",
    "jurisdictions/wa/local/south_bend_c7116f9e-640e-5538-b872-bcf564a423b6.yaml": "1ae27796de4749e025cbe8fbd48c39627981da11f6ae8bd4504c7e991a330622",
    "jurisdictions/wa/local/south_cle_elum_be5869d9-ecce-530b-b851-231fde50dc6b.yaml": "e9a8ac252102b0e90097bfbea4ba09253ab8790ba3e0180b1da8ec9b7559417d",
    "jurisdictions/wa/local/south_prairie_8806a0f0-5987-5ba6-b79d-693453f461d7.yaml": "78d541de0d7cc00b76e0f1cb5f30b189a65f8aae7c1a4ea22ad948fdee7a5179",
    "jurisdictions/wa/local/spangle_e8f33b92-292f-58f7-9aec-9d563a76155a.yaml": "e70c4bd145434e572f6a8bc2ea73b7540a56b9808b1a725fbc21bcfd1bd516be",
    "jurisdictions/wa/local/st_john_f6954e6e-3d15-51c8-a7f7-cb28ab3cc4ba.yaml": "a165b15bc7ac538f739177d1e1bf583a77b1cc2afcc99a2db8092712c4f88a19",
    "jurisdictions/wa/washington_stub.yaml": "2e6120611f3a8f45efc84502fa42bab887e0c95bc82ba500b05d650c81c1fc65"
  },
  "inventory_sha256": "3f266cff8534038e2e27c516ee3600172199b04c41a064306877a25ddafc5a8d",
  "run_id": "66ebc145fbeb08918a18",
  "schema_version": 1,
  "shared_artifact_count": 2,
  "shared_paths": [
    "divisions/wa/washington_stub.yaml",
    "jurisdictions/wa/washington_stub.yaml"
  ],
  "target_artifact_count": 40,
  "target_paths": [
    "divisions/wa/local/roslyn_5360055_9791a8c1-17b3-583a-94df-ecc9cf2946d4.yaml",
    "divisions/wa/local/roy_5360160_00cbf25c-b5ca-5866-8271-2e2a4e593f63.yaml",
    "divisions/wa/local/royal_city_5360230_eab43f82-5323-5070-9f15-566e472be607.yaml",
    "divisions/wa/local/ruston_5360510_0aef1da0-0200-58c0-ba4d-0d7ccc62dfe4.yaml",
    "divisions/wa/local/sammamish_5361115_6ac65a02-d320-5abd-89c1-3bee8a15c5ff.yaml",
    "divisions/wa/local/seatac_5362288_fbc84465-2017-5f3d-9049-cda4f930a783.yaml",
    "divisions/wa/local/sedro-woolley_5363210_9f1574d9-c80d-5688-aa8d-8d7da990d343.yaml",
    "divisions/wa/local/selah_5363280_b3dc154b-2429-5109-a209-906ca26e7d14.yaml",
    "divisions/wa/local/sequim_5363385_ea5eb65a-5478-500d-85e1-3b287fe5aee7.yaml",
    "divisions/wa/local/shelton_5363735_243e71e0-80e0-570a-83d3-35eb9866fea2.yaml",
    "divisions/wa/local/shoreline_5363960_8c43132d-24fa-511a-96f8-690f39b9b97d.yaml",
    "divisions/wa/local/skykomish_5364855_2d3623a9-b312-5302-bcf9-ab6592f50d84.yaml",
    "divisions/wa/local/snohomish_5365170_beb89d0c-bd20-5944-acdd-66f30d097cf7.yaml",
    "divisions/wa/local/snoqualmie_5365205_acd04e0c-d4fa-5dcc-a378-2abe1b663ad5.yaml",
    "divisions/wa/local/soap_lake_5365345_10be27a2-fc3d-5f2e-a598-85f4e468224a.yaml",
    "divisions/wa/local/south_bend_5365625_f3e2fdb7-2047-5ae1-9369-a979f1585ee1.yaml",
    "divisions/wa/local/south_cle_elum_5365765_e159eed1-3ef8-5209-a976-56499b187c2a.yaml",
    "divisions/wa/local/south_prairie_5366045_bb62e046-f9a9-5244-9565-90b8e7573a30.yaml",
    "divisions/wa/local/spangle_5366290_b755fb2c-6eed-5dc0-9fa3-1db6ef490481.yaml",
    "divisions/wa/local/st._john_5360860_2c05eeeb-08e9-569b-a6c5-051f96dee54e.yaml",
    "jurisdictions/wa/local/roslyn_56ba9bd7-7618-573e-b9ff-7f62a05c96ed.yaml",
    "jurisdictions/wa/local/roy_95eccf6a-98f1-53b4-a934-3642fb795772.yaml",
    "jurisdictions/wa/local/royal_city_756777f1-5612-5860-96c0-6dab7402fedf.yaml",
    "jurisdictions/wa/local/ruston_512e7499-33a1-5226-b698-d686c5ff04ef.yaml",
    "jurisdictions/wa/local/sammamish_0779e2b3-822c-5a9c-abf9-477c829994ed.yaml",
    "jurisdictions/wa/local/seatac_7037d44c-db44-5900-94f2-26a5b534ce53.yaml",
    "jurisdictions/wa/local/sedro-woolley_92e592a9-34ff-5fc0-aa5a-47209fd348b5.yaml",
    "jurisdictions/wa/local/selah_7bd82aca-a4e5-5bc5-b72a-11f461ab188a.yaml",
    "jurisdictions/wa/local/sequim_dc629222-8e07-5543-9ed6-723cf71bb843.yaml",
    "jurisdictions/wa/local/shelton_7f82c49a-384f-5ff9-8680-70e899261b0c.yaml",
    "jurisdictions/wa/local/shoreline_a6e208c4-59e9-57ea-b6dd-d986857eaf02.yaml",
    "jurisdictions/wa/local/skykomish_ecbac1c0-363a-5878-a596-5517707edb16.yaml",
    "jurisdictions/wa/local/snohomish_7ffebc86-3ebc-5883-80df-cf3cac48cf75.yaml",
    "jurisdictions/wa/local/snoqualmie_c19cd622-6539-58f2-bdb5-d9bf82c5f03e.yaml",
    "jurisdictions/wa/local/soap_lake_0543545c-898e-5026-9155-c47a603b72cf.yaml",
    "jurisdictions/wa/local/south_bend_c7116f9e-640e-5538-b872-bcf564a423b6.yaml",
    "jurisdictions/wa/local/south_cle_elum_be5869d9-ecce-530b-b851-231fde50dc6b.yaml",
    "jurisdictions/wa/local/south_prairie_8806a0f0-5987-5ba6-b79d-693453f461d7.yaml",
    "jurisdictions/wa/local/spangle_e8f33b92-292f-58f7-9aec-9d563a76155a.yaml",
    "jurisdictions/wa/local/st_john_f6954e6e-3d15-51c8-a7f7-cb28ab3cc4ba.yaml"
  ]
}
