{
  "file_count": 42,
  "files": {
    "divisions/wa/local/ione_5333560_b7ea43f4-0d46-50e6-af61-7f9c4ce4f8c6.yaml": "cb32c645753f82007a84380e8a782833c1699c3eaaae309901148d2ddb69917e",
    "divisions/wa/local/issaquah_5333805_2fdce080-6dd6-50d0-ba2c-425f4bebea57.yaml": "7dad4cdd6c46a5384e844dd5ad321a9fdae2dedf2624853a759f28c0aab2a71d",
    "divisions/wa/local/kahlotus_5334575_014ec053-23fb-5c92-b130-e45a4dfdaa25.yaml": "714b7d00c0ad5a41d3bb4c2e5e1d1bddad360e2fc8e3d89d6dc053cdc9df77e2",
    "divisions/wa/local/kalama_5334645_59fcf150-bbbc-53ba-9492-d7f3cb7300be.yaml": "ff2d6fe864400b9a9e042c7da0f066d97e9ce35bb9618a2a232831a925dcda95",
    "divisions/wa/local/kelso_5335065_cd2c7050-5d9a-5504-8504-201f37223f53.yaml": "7c32ab564d0d27099f5aafab4912eaaad053016647ebfa2146f7a83afecebafd",
    "divisions/wa/local/kenmore_5335170_976ea52b-81b5-5588-a802-ef3c2a63c82c.yaml": "459e166d88328677b2503f58e0954e13ff06544c4a66f10326b308bb75a68f21",
    "divisions/wa/local/kennewick_5335275_d0e3b13f-8284-5bef-8d1a-61aac67d7167.yaml": "190ba5ca4b90428d2d86ea2b01247a4d16f4c5b8ac8cb518a5b93eceb805dd03",
    "divisions/wa/local/kettle_falls_5335485_486c2d8f-0db4-5a2d-918e-ecdb8290b365.yaml": "79dd1c5f85f5829c1cde761bdc4e30024a40c7f6a52a707606cbb371cdbc23c0",
    "divisions/wa/local/kirkland_5335940_db72fcb8-d23f-5da7-ab8f-7db4c481b8eb.yaml": "d817220560bbc209ed853b98e3936bc8ae127fdc42162a5fb4af10d3c325b711",
    "divisions/wa/local/kittitas_5336045_eae4e5c4-899f-586a-b1f9-91e3a1550ad1.yaml": "e67557e1d245679dfcf1eb1b93a35a8ce1a8fffc08113a47bb14e181a34314e2",
    "divisions/wa/local/krupp_5336395_11155d41-7e8f-518a-ae55-bd2d622e1d46.yaml": "4ae4c0bfac87afc0eaed0b68049b12c95e2060dec268194900da30a87f537567",
    "divisions/wa/local/la_center_5336710_206ee195-64ef-5757-881a-755d70caa960.yaml": "560adfb3d6095f8bce2e0c2fbf03ae028b64a1b7195cbe58eef49aef167e7a99",
    "divisions/wa/local/la_conner_5336780_d50c58e2-473e-5046-845d-685492d36086.yaml": "a0df799bcd9c8c4a8d637d3d863e717fbb4b329ec181dcd875d7f93ccf86f563",
    "divisions/wa/local/lacey_5336745_765a9097-ce9f-5f19-8842-a34f5d92e535.yaml": "0f61660c584a5e3bbe7a1291c6b387a3b2653eb6f7a0e2fe4725d4a21c4c2a23",
    "divisions/wa/local/lacrosse_5336850_e359cd3f-c4d7-50e8-bdf9-a6254cd6f9e6.yaml": "f183fa34af90fb4111e953a971def7fcbeacb46b2571d7e0cd7d92acd5cca764",
    "divisions/wa/local/lake_forest_park_5337270_f900c473-a1c5-59fa-90d0-736b37ef010f.yaml": "78d0bedd7f7aebec404d0c5f531e86469896258077f9ddebab44ac92d9b6ba3d",
    "divisions/wa/local/lake_stevens_5337900_126cfb20-7d47-532e-8cb3-a5795e969526.yaml": "f32cb4c3fe4092d7ff78fadc6927c2bea4500dea56fee7238f8e9f96146655fe",
    "divisions/wa/local/lakewood_5338038_9cd33b49-2fcd-5a74-b621-6da64feb6c47.yaml": "6e5782c07adf19d5f92662b970794defaa87b77821b624f55795bba93933b823",
    "divisions/wa/local/lamont_5338215_26a6a45b-70a7-5b82-ab72-602b60dbdc9e.yaml": "eeaead72173dacd761a41b365aed7493f0005ef2d875bc48831f8ed92fc54cb3",
    "divisions/wa/local/langley_5338355_f6b2639b-32a8-5fc6-8bc2-2772052006aa.yaml": "a831bf31887b990d0edfc194ddd97b24ca8d5fa48a3e02b2e849f79125d352ee",
    "divisions/wa/washington_stub.yaml": "f8e17324c1c75bb62047a4855472f1a204566a19aa162e8ba5139d65af8b4e8d",
    "jurisdictions/wa/local/ione_d213606b-876e-5103-b50b-ba80b690c0e1.yaml": "4a0b123280e2ba3bc26e7c6279aac0d51ed77f233c8ab1674a52c77da46cab02",
    "jurisdictions/wa/local/issaquah_e9236fae-70d7-56c5-86b1-05b3742b5149.yaml": "c7e1aecc4bbde4e40bfc5da8fa43592f0cfd0231d45073522d3aecb9493dd78e",
    "jurisdictions/wa/local/kahlotus_83d7d4c8-a1f5-5b44-8efa-631fed0ce8a6.yaml": "7043c52ca713b00c85382e48d837ac4d14412c46fff2f4907604949b727053f5",
    "jurisdictions/wa/local/kalama_6da652af-8482-59e3-91ba-198eca80bd99.yaml": "5af698411b11cbb545bd2f65558a40da143a23df8d0884ae372013ce5fd55a0c",
    "jurisdictions/wa/local/kelso_fb963aba-8647-5ac6-88b2-27bf46ed01a7.yaml": "12c4998554b7507827b0688373b5a736f43be964d85890d459345dfe8a95d307",
    "jurisdictions/wa/local/kenmore_3dc8713c-5a71-5f66-b55b-18cffd758e0c.yaml": "5542c04ee7fc1330f98e34e1d13c7461f33f78e05579d1067880fd64ddf90f92",
    "jurisdictions/wa/local/kennewick_5cf51f8c-db3f-5bdc-9476-d53b18cf04f4.yaml": "de52917b7833062c46772170d54f9defad4e00eb11854b3165f9915c9903ae71",
    "jurisdictions/wa/local/kettle_falls_54f5a718-734b-5c83-b757-158520e0b46e.yaml": "220164ad1de9accfb617fe144e20efdae012cba5a07c9a884214b28c0872ab0d",
    "jurisdictions/wa/local/kirkland_6a3a2695-4c7e-52ae-a40b-c2b81e552650.yaml": "e733401e8a410746331b733f2dc080899669312c1ff8b3231cfd8e443cced9e4",
    "jurisdictions/wa/local/kittitas_6226a03e-b943-55b6-8e48-8c724ad8e1db.yaml": "0df6fe33abd75749f6513cf4c6a7bef72aab288f35142e9282fac1ef7ee35730",
    "jurisdictions/wa/local/krupp_bd37bd55-3ae1-53b3-b929-ed105c9ea94c.yaml": "e1d362df48dab1831050de57bb126298c178b0062031140ae0ba0ca794733c87",
    "jurisdictions/wa/local/la_center_2e8cd4c6-bed7-576b-af0d-ae10e6e17e48.yaml": "c396a55e0668e52bfbc3c5d98ec5da064d1931f89f8d21ddda6d2ac34974e69b",
    "jurisdictions/wa/local/la_conner_3496e557-eb99-53a1-9033-f2de9cc5650f.yaml": "d180eae5e8d3eb266f967fd1f85d12e4583bec903fb0521ca154a7ba4153228b",
    "jurisdictions/wa/local/lacey_1fc4f5e3-657c-5ef6-b33a-fd33c6eab885.yaml": "e059e6c26941564aac7751bbf86368f075ff88388278ef14e4c5b51b297fa532",
    "jurisdictions/wa/local/lacrosse_b3722d88-df8b-5774-b868-37985338561d.yaml": "05c497686d9af3e49affe1df18f6338e45929c8a9b65576517a8c6889f66c0a9",
    "jurisdictions/wa/local/lake_forest_park_52fbf81e-7fe8-568c-bd02-da0819b60411.yaml": "3e8c644f81f5c16d79c8fecb9ba8a889c2da3d3a317e0f6a5ca50e91a3f9481a",
    "jurisdictions/wa/local/lake_stevens_d2062b3b-9dd2-5b5c-b216-ec6695ac8204.yaml": "644a3ea4d0a1ef2aa4448678a2a023634a66fe8a6186c641f5e9679f1f64e42b",
    "jurisdictions/wa/local/lakewood_3064715f-d0b9-5b69-b2b4-f3f73cd59ee2.yaml": "cacb75489d691bda782c89fbb17075ab3f0ca8da0ab1fbeb1e23ae528aed2b9b",
    "jurisdictions/wa/local/lamont_bee69d50-9aab-5387-a0b9-f47da3550b8c.yaml": "ce28c5567522c067f1fdc8f036029cc48743bbe1e7da55a7e8aa46c0e2ba931a",
    "jurisdictions/wa/local/langley_35011c30-f090-5182-af93-39ccd1982b32.yaml": "0394e220af70e2d94528f10a9988e5db3d9a1f9f096d50a392c733ce940bb5f5",
    "jurisdictions/wa/washington_stub.yaml": "0b7c3073d7099ec5c671b2c470d7edf68e351fce0bbd2276190ee07b0abc17f8"
  },
  "inventory_sha256": "8f8328ad6d1d1e995a64905fb651d39b727eca69d436baa8c157dab2237a5cf2",
  "run_id": "7ad97093b4ee98e829e8",
  "schema_version": 1,
  "shared_artifact_count": 2,
  "shared_paths": [
    "divisions/wa/washington_stub.yaml",
    "jurisdictions/wa/washington_stub.yaml"
  ],
  "target_artifact_count": 40,
  "target_paths": [
    "divisions/wa/local/ione_5333560_b7ea43f4-0d46-50e6-af61-7f9c4ce4f8c6.yaml",
    "divisions/wa/local/issaquah_5333805_2fdce080-6dd6-50d0-ba2c-425f4bebea57.yaml",
    "divisions/wa/local/kahlotus_5334575_014ec053-23fb-5c92-b130-e45a4dfdaa25.yaml",
    "divisions/wa/local/kalama_5334645_59fcf150-bbbc-53ba-9492-d7f3cb7300be.yaml",
    "divisions/wa/local/kelso_5335065_cd2c7050-5d9a-5504-8504-201f37223f53.yaml",
    "divisions/wa/local/kenmore_5335170_976ea52b-81b5-5588-a802-ef3c2a63c82c.yaml",
    "divisions/wa/local/kennewick_5335275_d0e3b13f-8284-5bef-8d1a-61aac67d7167.yaml",
    "divisions/wa/local/kettle_falls_5335485_486c2d8f-0db4-5a2d-918e-ecdb8290b365.yaml",
    "divisions/wa/local/kirkland_5335940_db72fcb8-d23f-5da7-ab8f-7db4c481b8eb.yaml",
    "divisions/wa/local/kittitas_5336045_eae4e5c4-899f-586a-b1f9-91e3a1550ad1.yaml",
    "divisions/wa/local/krupp_5336395_11155d41-7e8f-518a-ae55-bd2d622e1d46.yaml",
    "divisions/wa/local/la_center_5336710_206ee195-64ef-5757-881a-755d70caa960.yaml",
    "divisions/wa/local/la_conner_5336780_d50c58e2-473e-5046-845d-685492d36086.yaml",
    "divisions/wa/local/lacey_5336745_765a9097-ce9f-5f19-8842-a34f5d92e535.yaml",
    "divisions/wa/local/lacrosse_5336850_e359cd3f-c4d7-50e8-bdf9-a6254cd6f9e6.yaml",
    "divisions/wa/local/lake_forest_park_5337270_f900c473-a1c5-59fa-90d0-736b37ef010f.yaml",
    "divisions/wa/local/lake_stevens_5337900_126cfb20-7d47-532e-8cb3-a5795e969526.yaml",
    "divisions/wa/local/lakewood_5338038_9cd33b49-2fcd-5a74-b621-6da64feb6c47.yaml",
    "divisions/wa/local/lamont_5338215_26a6a45b-70a7-5b82-ab72-602b60dbdc9e.yaml",
    "divisions/wa/local/langley_5338355_f6b2639b-32a8-5fc6-8bc2-2772052006aa.yaml",
    "jurisdictions/wa/local/ione_d213606b-876e-5103-b50b-ba80b690c0e1.yaml",
    "jurisdictions/wa/local/issaquah_e9236fae-70d7-56c5-86b1-05b3742b5149.yaml",
    "jurisdictions/wa/local/kahlotus_83d7d4c8-a1f5-5b44-8efa-631fed0ce8a6.yaml",
    "jurisdictions/wa/local/kalama_6da652af-8482-59e3-91ba-198eca80bd99.yaml",
    "jurisdictions/wa/local/kelso_fb963aba-8647-5ac6-88b2-27bf46ed01a7.yaml",
    "jurisdictions/wa/local/kenmore_3dc8713c-5a71-5f66-b55b-18cffd758e0c.yaml",
    "jurisdictions/wa/local/kennewick_5cf51f8c-db3f-5bdc-9476-d53b18cf04f4.yaml",
    "jurisdictions/wa/local/kettle_falls_54f5a718-734b-5c83-b757-158520e0b46e.yaml",
    "jurisdictions/wa/local/kirkland_6a3a2695-4c7e-52ae-a40b-c2b81e552650.yaml",
    "jurisdictions/wa/local/kittitas_6226a03e-b943-55b6-8e48-8c724ad8e1db.yaml",
    "jurisdictions/wa/local/krupp_bd37bd55-3ae1-53b3-b929-ed105c9ea94c.yaml",
    "jurisdictions/wa/local/la_center_2e8cd4c6-bed7-576b-af0d-ae10e6e17e48.yaml",
    "jurisdictions/wa/local/la_conner_3496e557-eb99-53a1-9033-f2de9cc5650f.yaml",
    "jurisdictions/wa/local/lacey_1fc4f5e3-657c-5ef6-b33a-fd33c6eab885.yaml",
    "jurisdictions/wa/local/lacrosse_b3722d88-df8b-5774-b868-37985338561d.yaml",
    "jurisdictions/wa/local/lake_forest_park_52fbf81e-7fe8-568c-bd02-da0819b60411.yaml",
    "jurisdictions/wa/local/lake_stevens_d2062b3b-9dd2-5b5c-b216-ec6695ac8204.yaml",
    "jurisdictions/wa/local/lakewood_3064715f-d0b9-5b69-b2b4-f3f73cd59ee2.yaml",
    "jurisdictions/wa/local/lamont_bee69d50-9aab-5387-a0b9-f47da3550b8c.yaml",
    "jurisdictions/wa/local/langley_35011c30-f090-5182-af93-39ccd1982b32.yaml"
  ]
}
