{
  "file_count": 42,
  "files": {
    "divisions/wa/local/latah_5338495_966338b5-4c8b-5672-809b-40ff1704ceee.yaml": "4c07c51ea24d44aeec200c36b77e47f32e33d7c55eeb2931255bb6d3e57bea89",
    "divisions/wa/local/leavenworth_5338845_b299f1d8-168a-5620-a3bc-7927dc4cd48f.yaml": "23ecf646c335553895ebc94ebbbc5a52baa1513878ea455b0dc05601297b20b5",
    "divisions/wa/local/liberty_lake_5339335_bd65376e-c17b-5236-9ed2-b94ebd7fb4c8.yaml": "932edb2b58d0dcf1d3cb7fbe7fd5ba9358941af94e6856dba31407a811e52086",
    "divisions/wa/local/lind_5339510_4e1102bb-8be2-52ea-9cbe-9d18c399387f.yaml": "4bd02c21102b0c3765194a17e97a7d58e0c5470dc8705453519c6ad55e19f77a",
    "divisions/wa/local/long_beach_5340070_4fe9bd4e-e0c4-5e30-89d0-b90e4db7f297.yaml": "29bddeae90361a24f7e6d3c50d262765a02728e95f786d9a969dd76ae6866c98",
    "divisions/wa/local/longview_5340245_306ba6ac-311d-59ec-8be0-3d6e34bb58cb.yaml": "55cb0a230203b4a7a565956a8a9364f044445da2c97549a0803c80009af4fab9",
    "divisions/wa/local/lyman_5340770_928b65ca-3894-5f4e-8f67-25ed46313ddd.yaml": "c937c2e8a3f8a0d67053ae7c36f31e93a03fc0abbb28e1e5fc900a43f72213b9",
    "divisions/wa/local/lynden_5340805_50d4e634-beb2-51c4-bf26-6eb5bceed057.yaml": "729ebab4ad9d28b0a7d12a9f9a68eefea5c57a4a233d98a20ef2988347b7d33e",
    "divisions/wa/local/lynnwood_5340840_e453bb07-7c0a-5fdb-9931-655d3b8ea903.yaml": "0160015759341d99302fc34201d4a51ff6604bce70e85bf50d4fe6cc9f21f216",
    "divisions/wa/local/mabton_5340980_42065fcf-bb99-5dc2-b7df-423a2018d262.yaml": "66098b3ce9d82e3efc72d050daa92745780344660330c15b0bf4523039fefd09",
    "divisions/wa/local/malden_5342275_cd16448d-8d5a-57e8-a266-071ccd3bf73b.yaml": "8d29c9a4195dd89c7203ae31f30df071af5c72c0200f5920fbd969b81a903b21",
    "divisions/wa/local/mansfield_5342800_c9966bef-7697-5bb7-9aa3-36fc366e0cf4.yaml": "9282f7d49b199eb85af4a0615ba3ec63e7ce845910d5873247f8147f698a31e4",
    "divisions/wa/local/maple_valley_5343150_3fbcc18b-e30e-51d0-972b-d2b685f1cbca.yaml": "22429790778970385c98f00bb09d1b0065befa14d3db29f24a02dc5b8bbb6f70",
    "divisions/wa/local/marcus_5343395_90516495-28e3-5778-828c-4568000ff573.yaml": "5f211dc509582fd0e1c73fb5703a9f1e6f614ddd89cc335e6e872dc7bc4f30c2",
    "divisions/wa/local/marysville_5343955_8580edf3-2360-589b-9e67-784d675d7155.yaml": "2f810f484e0b4048043061b62926642088d1bf8b31e22d9bedbb6d9189bb3c84",
    "divisions/wa/local/mattawa_5344165_76e0151e-f1bd-5e8d-90b1-dce6a71149ad.yaml": "c4065e5f5dc33ef236c12c3f1a5fcd29b52a5e6cd46b061bc493121377a6a8a1",
    "divisions/wa/local/mccleary_5341225_a4d1f512-5e0f-5942-9662-89fb37c78ea6.yaml": "828c439dee206fa8491999bc47ca2fb24d9082fb7f560d039a4d433592d668d3",
    "divisions/wa/local/medical_lake_5344690_88aa1b64-2442-5d86-b0c0-3edcb3e0036c.yaml": "94b43e46545e087e1bd0cdb55088bab31453a5b46f5723f017781b3e47582a09",
    "divisions/wa/local/medina_5344725_6dd4f023-4e94-5db4-9a72-3325190b7da9.yaml": "d7bcd24f8bfd27f825e6b718857d802213982d35f425785acced7974e649d6ed",
    "divisions/wa/local/mercer_island_5345005_117d26b1-c824-5ff1-9632-a89dc629ed7a.yaml": "ecc0659296ad53f6b8ec3cdab149500e34c03388b713d090143f9a1acefd2456",
    "divisions/wa/washington_stub.yaml": "228a546828dd2391070b94eeff364df7ee878bf427a86fc44844dbc91174c1ff",
    "jurisdictions/wa/local/latah_a973b1e9-5fda-55a3-a8e0-189285ddc4e7.yaml": "fbce2552def134d19bdd9d7acd1113d7ccf7b029b797a64bd3cf597bd5f8ec62",
    "jurisdictions/wa/local/leavenworth_553b2891-677c-53e6-8d85-9317c9e6f6ee.yaml": "9e77fc9527af8e32447cd6bd5ff3d15a000fb72f39d7905e02534071e6de282d",
    "jurisdictions/wa/local/liberty_lake_e5c6c4a3-04f3-583c-a10e-c728ee7c694a.yaml": "9b0a3d0d5fb4bf72b0def17196eb181c793b6aa7feb7968a1b186ab5a776ec60",
    "jurisdictions/wa/local/lind_9b28c4c6-2f43-5027-9d14-420abd4456c0.yaml": "e6646762219ba31dd18b32d70de92fadc085e4889ccab352062323aaf3007b62",
    "jurisdictions/wa/local/long_beach_0338a9b4-4a21-500e-908a-09142b008414.yaml": "5ef30a9ee521e4ed7eef6dec94ca7bea6421f8521201ccf155d83c5b47bcf477",
    "jurisdictions/wa/local/longview_dff34bb4-a80f-5630-b330-987b315dc777.yaml": "166a11075dfba3cc1dcf9d4ad29b8ad062b5e51857e1c291448648dedb530e76",
    "jurisdictions/wa/local/lyman_032ba616-f524-5f7f-9bc7-7400f4f4db6c.yaml": "45aaf77fb0f39b135ce92598efc68ab968534f7b2a23f66493909654ba0d1bf2",
    "jurisdictions/wa/local/lynden_60ffd4bf-449e-577c-80f4-04d246d83cb7.yaml": "009397fd881db9e92a357e573de4b140de02b330616c66b8647d6235336554e8",
    "jurisdictions/wa/local/lynnwood_5c54e589-d517-59cc-8f0b-0944f7fd19f2.yaml": "ac50668891b46432231967a11c508aee6bb2bc22b18b371beadfab33f28931e2",
    "jurisdictions/wa/local/mabton_7f7432d1-2f6b-5b3c-ab23-2617473b1ba6.yaml": "6803f77120b0036a03d34be572dffc14c363344c31925b510e04cfc4c5e4dbcf",
    "jurisdictions/wa/local/malden_25a14146-a7a1-5043-81f0-17464e9964d4.yaml": "7174648482565bcfa911e317eb8e66d6d3437b272a79610871573c0ee3f426a7",
    "jurisdictions/wa/local/mansfield_7862a5ec-8432-51c4-9cb9-bd37a3ba089f.yaml": "56f32b67cea28d656be0b56209e2cac112f3eb8f4a566edc8279579b0e22bb75",
    "jurisdictions/wa/local/maple_valley_be224be3-4b55-5e1e-a3fd-c676951fb224.yaml": "10430db8de88f592edf7589b5052555a8cfeec9f8ef12e55178aad320c996d27",
    "jurisdictions/wa/local/marcus_cb9addce-aff3-5bc5-9c8c-5bbf2a848671.yaml": "d55de7e651b00c8c35cabe02b8ef9b1cd4f9bb2cc0ef8d860f8bdb30d8b7976d",
    "jurisdictions/wa/local/marysville_fd226f68-f8a3-5381-85de-7c46c092c5bc.yaml": "beabeac648b4a58a256d37d775130960ec6d841fb2789e89930bc113360589bb",
    "jurisdictions/wa/local/mattawa_2937dd93-20de-54fa-b46e-2e3de038fe22.yaml": "7d0171df9d52d93e0cd566927fa5e19623b5c68532cda3bf308322af0a45499d",
    "jurisdictions/wa/local/mccleary_829aefcc-29e3-500c-a488-18100faebd1d.yaml": "425ff0328c3ac2a7dceba6266b398135c3245b25f800e832d1fa247e29e28402",
    "jurisdictions/wa/local/medical_lake_9f000479-9b66-594d-8fca-c46c741c1902.yaml": "879805a6d965ca2d2050ef810d221d3f1579721bf17fd8676e893c29075a2cb6",
    "jurisdictions/wa/local/medina_bb79eb34-3981-5757-87d3-50f0ed446d79.yaml": "7c1feb9d67002381a59948a35c73fd6dc52080695dc09b9e74a600fec3fbe05c",
    "jurisdictions/wa/local/mercer_island_bdef0301-8f35-5c14-a409-eccb5d334763.yaml": "0e01850d2af9121bbac7f25e1e7affa95e01c17c2549ca5482bba5c9806d4103",
    "jurisdictions/wa/washington_stub.yaml": "36644c9b874958dd421a0695225c344b4521b0411de5560ff028e74203003a64"
  },
  "inventory_sha256": "cf8fa6e4571f2a367a4faac63266abc03e19d2c78596c312710214763a0e16d2",
  "run_id": "bece54b9e87136456a55",
  "schema_version": 1,
  "shared_artifact_count": 2,
  "shared_paths": [
    "divisions/wa/washington_stub.yaml",
    "jurisdictions/wa/washington_stub.yaml"
  ],
  "target_artifact_count": 40,
  "target_paths": [
    "divisions/wa/local/latah_5338495_966338b5-4c8b-5672-809b-40ff1704ceee.yaml",
    "divisions/wa/local/leavenworth_5338845_b299f1d8-168a-5620-a3bc-7927dc4cd48f.yaml",
    "divisions/wa/local/liberty_lake_5339335_bd65376e-c17b-5236-9ed2-b94ebd7fb4c8.yaml",
    "divisions/wa/local/lind_5339510_4e1102bb-8be2-52ea-9cbe-9d18c399387f.yaml",
    "divisions/wa/local/long_beach_5340070_4fe9bd4e-e0c4-5e30-89d0-b90e4db7f297.yaml",
    "divisions/wa/local/longview_5340245_306ba6ac-311d-59ec-8be0-3d6e34bb58cb.yaml",
    "divisions/wa/local/lyman_5340770_928b65ca-3894-5f4e-8f67-25ed46313ddd.yaml",
    "divisions/wa/local/lynden_5340805_50d4e634-beb2-51c4-bf26-6eb5bceed057.yaml",
    "divisions/wa/local/lynnwood_5340840_e453bb07-7c0a-5fdb-9931-655d3b8ea903.yaml",
    "divisions/wa/local/mabton_5340980_42065fcf-bb99-5dc2-b7df-423a2018d262.yaml",
    "divisions/wa/local/malden_5342275_cd16448d-8d5a-57e8-a266-071ccd3bf73b.yaml",
    "divisions/wa/local/mansfield_5342800_c9966bef-7697-5bb7-9aa3-36fc366e0cf4.yaml",
    "divisions/wa/local/maple_valley_5343150_3fbcc18b-e30e-51d0-972b-d2b685f1cbca.yaml",
    "divisions/wa/local/marcus_5343395_90516495-28e3-5778-828c-4568000ff573.yaml",
    "divisions/wa/local/marysville_5343955_8580edf3-2360-589b-9e67-784d675d7155.yaml",
    "divisions/wa/local/mattawa_5344165_76e0151e-f1bd-5e8d-90b1-dce6a71149ad.yaml",
    "divisions/wa/local/mccleary_5341225_a4d1f512-5e0f-5942-9662-89fb37c78ea6.yaml",
    "divisions/wa/local/medical_lake_5344690_88aa1b64-2442-5d86-b0c0-3edcb3e0036c.yaml",
    "divisions/wa/local/medina_5344725_6dd4f023-4e94-5db4-9a72-3325190b7da9.yaml",
    "divisions/wa/local/mercer_island_5345005_117d26b1-c824-5ff1-9632-a89dc629ed7a.yaml",
    "jurisdictions/wa/local/latah_a973b1e9-5fda-55a3-a8e0-189285ddc4e7.yaml",
    "jurisdictions/wa/local/leavenworth_553b2891-677c-53e6-8d85-9317c9e6f6ee.yaml",
    "jurisdictions/wa/local/liberty_lake_e5c6c4a3-04f3-583c-a10e-c728ee7c694a.yaml",
    "jurisdictions/wa/local/lind_9b28c4c6-2f43-5027-9d14-420abd4456c0.yaml",
    "jurisdictions/wa/local/long_beach_0338a9b4-4a21-500e-908a-09142b008414.yaml",
    "jurisdictions/wa/local/longview_dff34bb4-a80f-5630-b330-987b315dc777.yaml",
    "jurisdictions/wa/local/lyman_032ba616-f524-5f7f-9bc7-7400f4f4db6c.yaml",
    "jurisdictions/wa/local/lynden_60ffd4bf-449e-577c-80f4-04d246d83cb7.yaml",
    "jurisdictions/wa/local/lynnwood_5c54e589-d517-59cc-8f0b-0944f7fd19f2.yaml",
    "jurisdictions/wa/local/mabton_7f7432d1-2f6b-5b3c-ab23-2617473b1ba6.yaml",
    "jurisdictions/wa/local/malden_25a14146-a7a1-5043-81f0-17464e9964d4.yaml",
    "jurisdictions/wa/local/mansfield_7862a5ec-8432-51c4-9cb9-bd37a3ba089f.yaml",
    "jurisdictions/wa/local/maple_valley_be224be3-4b55-5e1e-a3fd-c676951fb224.yaml",
    "jurisdictions/wa/local/marcus_cb9addce-aff3-5bc5-9c8c-5bbf2a848671.yaml",
    "jurisdictions/wa/local/marysville_fd226f68-f8a3-5381-85de-7c46c092c5bc.yaml",
    "jurisdictions/wa/local/mattawa_2937dd93-20de-54fa-b46e-2e3de038fe22.yaml",
    "jurisdictions/wa/local/mccleary_829aefcc-29e3-500c-a488-18100faebd1d.yaml",
    "jurisdictions/wa/local/medical_lake_9f000479-9b66-594d-8fca-c46c741c1902.yaml",
    "jurisdictions/wa/local/medina_bb79eb34-3981-5757-87d3-50f0ed446d79.yaml",
    "jurisdictions/wa/local/mercer_island_bdef0301-8f35-5c14-a409-eccb5d334763.yaml"
  ]
}
